{
  "$ref": "#/definitions/flashcards",
  "definitions": {
    "flashcards": {
      "type": "object",
      "properties": {
        "title": {
          "type": "string",
          "minLength": 5,
          "maxLength": 60
        },
        "exam": {
          "type": "string",
          "enum": [
            "ccat",
            "gate-cse"
          ]
        },
        "subject": {
          "type": "string"
        },
        "topic": {
          "type": "string"
        },
        "description": {
          "type": "string",
          "minLength": 120,
          "maxLength": 158
        },
        "relatedCheatsheet": {
          "type": "string"
        },
        "cards": {
          "type": "array",
          "items": {
            "type": "object",
            "properties": {
              "front": {
                "type": "string"
              },
              "back": {
                "type": "string"
              }
            },
            "required": [
              "front",
              "back"
            ],
            "additionalProperties": false
          }
        },
        "$schema": {
          "type": "string"
        }
      },
      "required": [
        "title",
        "exam",
        "subject",
        "topic",
        "description",
        "cards"
      ],
      "additionalProperties": false
    }
  },
  "$schema": "http://json-schema.org/draft-07/schema#"
}